{
  "version": "2026.05.25",
  "source": "PDF 津门学路通 P30 集团化办学",
  "count": 32,
  "items": [
    {
      "id": "grp_a549379f0c",
      "district": "和平区",
      "name": "岳阳教育集团",
      "leads": [
        {
          "name": "岳阳道小学",
          "school_id": "sch_01f24f17d1",
          "matched_school": "岳阳道小学"
        }
      ],
      "members": [
        {
          "name": "西康路小学",
          "school_id": "sch_d17ca8fb5a",
          "matched_school": "西康路小学",
          "stopped": false
        },
        {
          "name": "新星小学",
          "school_id": "sch_b1bd456d62",
          "matched_school": "和平新星小学",
          "stopped": false
        },
        {
          "name": "二十中附属小学",
          "school_id": "sch_2e8e54c325",
          "matched_school": "第二十中学附属小学",
          "stopped": false
        }
      ],
      "note": null
    },
    {
      "id": "grp_29fec2dcf0",
      "district": "和平区",
      "name": "万全教育集团",
      "leads": [
        {
          "name": "和平万全小学",
          "school_id": "sch_7eba9a6eb1",
          "matched_school": "万全小学"
        }
      ],
      "members": [
        {
          "name": "劝业场小学",
          "school_id": "sch_0d7863165b",
          "matched_school": "劝业场小学",
          "stopped": false
        },
        {
          "name": "哈密道小学",
          "school_id": "sch_994ad86cd8",
          "matched_school": "哈密道小学",
          "stopped": false
        }
      ],
      "note": null
    },
    {
      "id": "grp_1d98a80ea2",
      "district": "和平区",
      "name": "昆明教育集团",
      "leads": [
        {
          "name": "昆明路小学",
          "school_id": "sch_c082652a56",
          "matched_school": "昆明路小学"
        }
      ],
      "members": [
        {
          "name": "四平东道小学",
          "school_id": "sch_7d6a5dede9",
          "matched_school": "四平东道小学",
          "stopped": false
        },
        {
          "name": "镜辉小学(停招)",
          "school_id": null,
          "matched_school": null,
          "stopped": true
        },
        {
          "name": "三毛艺术(停招)",
          "school_id": null,
          "matched_school": null,
          "stopped": true
        }
      ],
      "note": null
    },
    {
      "id": "grp_b734348d5e",
      "district": "南开区",
      "name": "南开共同体",
      "leads": [
        {
          "name": "南开中学",
          "school_id": "sch_ccddb121c0",
          "matched_school": "南开中学"
        }
      ],
      "members": [
        {
          "name": "翔宇中学",
          "school_id": "sch_49e581098e",
          "matched_school": "翔宇学校",
          "stopped": false
        },
        {
          "name": "崇化中学(停招)",
          "school_id": "sch_707a1225e9",
          "matched_school": "崇化中学(北马路)",
          "stopped": true
        },
        {
          "name": "五十中学",
          "school_id": "sch_7a7b274706",
          "matched_school": "五十中学",
          "stopped": false
        },
        {
          "name": "南开科技实验中学",
          "school_id": "sch_7e637c6a0b",
          "matched_school": "南开区科技实验中学",
          "stopped": false
        }
      ],
      "note": null
    },
    {
      "id": "grp_6550135ca7",
      "district": "南开区",
      "name": "二十五中共同体",
      "leads": [
        {
          "name": "二十五中",
          "school_id": "sch_2da29fadaa",
          "matched_school": "第二十五中学"
        }
      ],
      "members": [
        {
          "name": "津英中学",
          "school_id": "sch_342efc18da",
          "matched_school": "津英中学(完全中学)",
          "stopped": false
        },
        {
          "name": "科技实验",
          "school_id": "sch_7e637c6a0b",
          "matched_school": "南开区科技实验中学",
          "stopped": false
        },
        {
          "name": "四十三",
          "school_id": "sch_792486cef8",
          "matched_school": "第四十三中学",
          "stopped": false
        },
        {
          "name": "美达菲",
          "school_id": "sch_849852f3b8",
          "matched_school": "美达菲学校",
          "stopped": false
        }
      ],
      "note": null
    },
    {
      "id": "grp_325e81a7ca",
      "district": "南开区",
      "name": "南大附中天大附中共同体",
      "leads": [
        {
          "name": "南大附中",
          "school_id": "sch_5a4d0cda3c",
          "matched_school": "南开大学附属中学"
        },
        {
          "name": "天大附中",
          "school_id": "sch_4e92d01cda",
          "matched_school": "天津大学附属中学"
        }
      ],
      "members": [
        {
          "name": "六十三中",
          "school_id": "sch_5cccb7a822",
          "matched_school": "第六十三中学",
          "stopped": false
        },
        {
          "name": "师大南开附中",
          "school_id": "sch_338d41edb4",
          "matched_school": "师大南开附属中学",
          "stopped": false
        },
        {
          "name": "翔宇弘德",
          "school_id": "sch_eba091a9a8",
          "matched_school": "翔宇弘德学校",
          "stopped": false
        }
      ],
      "note": null
    },
    {
      "id": "grp_e57981d828",
      "district": "南开区",
      "name": "天津中学共同体",
      "leads": [
        {
          "name": "天津中学",
          "school_id": "sch_80de38950e",
          "matched_school": "天津中学"
        }
      ],
      "members": [
        {
          "name": "日新国际",
          "school_id": "sch_764ed310e4",
          "matched_school": "日新国际学校",
          "stopped": false
        },
        {
          "name": "实验",
          "school_id": "sch_426290e61b",
          "matched_school": "科技实验小学",
          "stopped": false
        },
        {
          "name": "第九中学",
          "school_id": "sch_15e0ffcc8f",
          "matched_school": "第九中学",
          "stopped": false
        },
        {
          "name": "师大附属实验中学",
          "school_id": "sch_1c6f104431",
          "matched_school": "师大附属实验中学",
          "stopped": false
        }
      ],
      "note": null
    },
    {
      "id": "grp_28cf20967e",
      "district": "南开区",
      "name": "中营小学共同体",
      "leads": [
        {
          "name": "中营小学",
          "school_id": "sch_094ce46111",
          "matched_school": "中营小学"
        }
      ],
      "members": [
        {
          "name": "中营瑞丽小学",
          "school_id": "sch_62904cfb07",
          "matched_school": "中营瑞丽小学",
          "stopped": false
        },
        {
          "name": "日新小学",
          "school_id": "sch_764ed310e4",
          "matched_school": "日新国际学校",
          "stopped": false
        },
        {
          "name": "美达菲小学",
          "school_id": "sch_849852f3b8",
          "matched_school": "美达菲学校",
          "stopped": false
        },
        {
          "name": "艺术小学",
          "school_id": "sch_894130019e",
          "matched_school": "南开艺术小学",
          "stopped": false
        },
        {
          "name": "永基小学",
          "school_id": "sch_7a55636725",
          "matched_school": "永基小学",
          "stopped": false
        },
        {
          "name": "西营门外小学",
          "school_id": "sch_b2fa82f18c",
          "matched_school": "西营门外小学",
          "stopped": false
        }
      ],
      "note": null
    },
    {
      "id": "grp_eba1b2e5e2",
      "district": "南开区",
      "name": "五马路小学共同体",
      "leads": [
        {
          "name": "五马路小学",
          "school_id": "sch_5dbe970249",
          "matched_school": "五马路小学"
        }
      ],
      "members": [
        {
          "name": "义兴里小学",
          "school_id": "sch_4c6574937e",
          "matched_school": "义兴里小学",
          "stopped": false
        },
        {
          "name": "长治里小学",
          "school_id": "sch_a3649b738c",
          "matched_school": "长治里小学",
          "stopped": false
        },
        {
          "name": "前园小学",
          "school_id": "sch_b08b2accd3",
          "matched_school": "前园小学",
          "stopped": false
        },
        {
          "name": "跃升里小学",
          "school_id": "sch_65595e1531",
          "matched_school": "跃升里小学",
          "stopped": false
        },
        {
          "name": "南大附中南方小学",
          "school_id": "sch_3ee9fc8510",
          "matched_school": "南大附小",
          "stopped": false
        }
      ],
      "note": null
    },
    {
      "id": "grp_a58fcdff5e",
      "district": "南开区",
      "name": "中心小学共同体",
      "leads": [
        {
          "name": "中心小学",
          "school_id": "sch_e21099ad2f",
          "matched_school": "南开区中心小学"
        }
      ],
      "members": [
        {
          "name": "科技实验小学",
          "school_id": "sch_426290e61b",
          "matched_school": "科技实验小学",
          "stopped": false
        },
        {
          "name": "南开小学",
          "school_id": "sch_2c27d19dad",
          "matched_school": "南开小学",
          "stopped": false
        },
        {
          "name": "风湖里小学",
          "school_id": "sch_06bbf13760",
          "matched_school": "风湖里小学",
          "stopped": false
        },
        {
          "name": "汾水道小学",
          "school_id": "sch_56da04be25",
          "matched_school": "汾水道小学",
          "stopped": false
        },
        {
          "name": "师大附属天大附小",
          "school_id": "sch_5261805492",
          "matched_school": "天大附小",
          "stopped": false
        }
      ],
      "note": null
    },
    {
      "id": "grp_eaf69de825",
      "district": "南开区",
      "name": "师大南开附小共同体",
      "leads": [
        {
          "name": "师大南开附小",
          "school_id": "sch_25d6ebf746",
          "matched_school": "师大南开附小"
        }
      ],
      "members": [
        {
          "name": "咸阳路小学",
          "school_id": "sch_506ded5acd",
          "matched_school": "咸阳路小学",
          "stopped": false
        },
        {
          "name": "宜宾里小学",
          "school_id": "sch_96ca5496a1",
          "matched_school": "宜宾里小学",
          "stopped": false
        },
        {
          "name": "川府里小学",
          "school_id": "sch_f7c0aaadc2",
          "matched_school": "川府里小学",
          "stopped": false
        },
        {
          "name": "小南大附小",
          "school_id": "sch_3ee9fc8510",
          "matched_school": "南大附小",
          "stopped": false
        },
        {
          "name": "弘扬学校小学部",